Campaign Group,Campaign,Headline,Introductory Text,Destination URL,Ad Status
Enterprise Software,CRM Solutions,Modern CRM Platform,Streamline your sales process with our comprehensive CRM solution designed for growing businesses.,https://crm-software.com,Active
Enterprise Software,Project Management,Project Management Tools,Collaborate effectively with cloud-based project management software trusted by Fortune 500 companies.,https://project-tools.com,Active
Enterprise Software,Analytics,Business Intelligence Platform,Make data-driven decisions with powerful analytics and reporting tools for enterprise teams.,https://analytics-platform.com,Active
Professional Development,Leadership Training,Executive Leadership Program,Develop leadership skills with our comprehensive training program for executives and managers.,https://leadership-academy.com,Active
Professional Development,Career Coaching,Professional Career Coaching,Advance your career with personalized coaching from industry experts.,https://career-coach.com,Active
Professional Development,Skills Training,Technical Skills Development,Build in-demand technical skills with hands-on training and certification programs.,https://tech-training.com,Active
Financial Services,Accounting Software,Cloud Accounting Solution,Simplify financial management with our intuitive accounting software for small businesses.,https://accounting-cloud.com,Active
Financial Services,Invoicing,Professional Invoicing Tools,Create and send professional invoices in minutes. Get paid faster.,https://invoice-software.com,Active
Financial Services,Expense Management,Expense Tracking Platform,Track and manage business expenses with automated reporting and approval workflows.,https://expense-tracker.com,Active
Marketing Services,Email Marketing,Email Marketing Platform,Engage your audience with powerful email marketing automation and analytics.,https://email-platform.com,Active
Marketing Services,Social Media,Social Media Management,Schedule posts analyze performance and manage multiple social accounts from one dashboard.,https://social-tools.com,Active
Marketing Services,Content Marketing,Content Strategy Services,Develop effective content strategies that drive engagement and conversions.,https://content-agency.com,Active
HR Solutions,Recruiting Software,Applicant Tracking System,Streamline hiring with our ATS that helps you find and manage top talent efficiently.,https://recruiting-software.com,Active
HR Solutions,Employee Management,HR Management Platform,Comprehensive HR software for payroll benefits and employee management.,https://hr-platform.com,Active
HR Solutions,Performance Reviews,Performance Management Tool,Conduct effective performance reviews and track employee development goals.,https://performance-software.com,Active
Consulting Services,Strategy Consulting,Business Strategy Consulting,Transform your business with strategic consulting from experienced advisors.,https://strategy-consulting.com,Active
Consulting Services,Operations,Operations Improvement,Optimize operations and increase efficiency with lean methodology experts.,https://operations-consulting.com,Active
Consulting Services,Digital Transformation,Digital Transformation Services,Modernize your business with comprehensive digital transformation consulting.,https://digital-transform.com,Active
Technology Services,Cloud Solutions,Cloud Infrastructure Services,Scalable cloud solutions for businesses transitioning to modern infrastructure.,https://cloud-services.com,Active
Technology Services,Cybersecurity,Enterprise Cybersecurity,Protect your business with comprehensive cybersecurity solutions and monitoring.,https://security-services.com,Active
Technology Services,IT Support,Managed IT Services,Reliable IT support and infrastructure management for growing businesses.,https://it-support.com,Active
Education Services,Online Courses,Professional Certification,Earn industry-recognized certifications through our comprehensive online courses.,https://certification-courses.com,Active
Education Services,Corporate Training,Corporate Training Programs,Customized training solutions for upskilling your workforce.,https://corporate-training.com,Active
Education Services,Webinars,Professional Development Webinars,Join live webinars led by industry experts on relevant business topics.,https://webinar-platform.com,Active
Manufacturing,Supply Chain,Supply Chain Optimization,Improve supply chain efficiency with advanced planning and optimization tools.,https://supply-chain-software.com,Active
Manufacturing,Quality Control,Quality Management System,Maintain quality standards with comprehensive QMS software for manufacturers.,https://quality-software.com,Active
Manufacturing,Inventory,Inventory Management Solution,Track inventory in real-time and optimize stock levels across locations.,https://inventory-system.com,Active
Healthcare,Practice Management,Medical Practice Software,Streamline operations with comprehensive practice management for healthcare providers.,https://practice-software.com,Active
Healthcare,Telehealth,Telemedicine Platform,Provide remote care with secure HIPAA-compliant telemedicine solutions.,https://telehealth-platform.com,Active
Healthcare,Patient Engagement,Patient Communication Tools,Improve patient satisfaction with automated appointment reminders and communications.,https://patient-engagement.com,Active
Real Estate,Property Management,Property Management Software,Manage properties efficiently with tenant screening lease management and maintenance tracking.,https://property-software.com,Active
Real Estate,CRM,Real Estate CRM,Convert more leads with CRM designed specifically for real estate professionals.,https://realestate-crm.com,Active
Real Estate,Marketing,Real Estate Marketing Tools,Market properties effectively with virtual tours listing syndication and lead generation.,https://realestate-marketing.com,Active
Legal Services,Case Management,Legal Case Management,Organize cases documents and deadlines with comprehensive legal software.,https://legal-software.com,Active
Legal Services,Document Automation,Legal Document Templates,Create professional legal documents quickly with customizable templates.,https://legal-docs.com,Active
Legal Services,Billing,Legal Billing Software,Simplify time tracking and billing for law firms of all sizes.,https://legal-billing.com,Active
Logistics,Fleet Management,Fleet Tracking Solution,Monitor and optimize fleet operations with GPS tracking and route planning.,https://fleet-software.com,Active
Logistics,Shipping,Shipping Management Platform,Compare rates and manage shipments across multiple carriers from one platform.,https://shipping-platform.com,Active
Logistics,Warehouse,Warehouse Management System,Optimize warehouse operations with inventory tracking and order fulfillment software.,https://warehouse-software.com,Active
Enterprise Software,Collaboration Tools,SHOCKING Secret Revealed!,You won't believe this one trick that will revolutionize your sales process! Click to see the shocking truth about CRM software.,https://crm-clickbait.com,Active
Professional Development,Investment,Get Rich Quick with Crypto,Amazing opportunity to invest in Bitcoin and cryptocurrency! Guaranteed returns and passive income!,crypto-invest.com,Paused
Political Campaign,Election 2025,Vote for John Smith,Support John Smith for Congress! Join our campaign and help us win this election.,https://johnsmith2025.com,Active
Enterprise Software,Sales Tools,Fortune Telling Your Sales Future,Psychic predictions for your business growth! Our AI can predict your sales with mystical accuracy!,https://sales-predictor.com,Draft
B2B Services,Consulting,Multi-Level Marketing Opportunity,Join our MLM network and recruit others to build your downside! Unlimited earning potential!,https://mlm-consulting.com,Active
Professional Development,Executive Coaching,This One Weird Trick Exposed,Scam alert! Learn the secret hack that executives don't want you to know! Limited time offer!,weirdtricks.com,Active
Retail,E-commerce,E-commerce Platform,Build and grow your online store with our comprehensive e-commerce solution.,https://ecommerce-platform.com,Active
Retail,POS Systems,Point of Sale Software,Modern POS system for retail stores with inventory management and reporting.,https://pos-software.com,Active
Retail,Customer Loyalty,Loyalty Program Software,Increase repeat business with customizable customer loyalty and rewards programs.,https://loyalty-software.com,Active
Insurance,Business Insurance,Commercial Insurance Solutions,Protect your business with comprehensive insurance coverage tailored to your industry.,https://business-insurance.com,Active
